,title,authors,abstract
0,Calculation of prompt diphoton production cross sections at Tevatron and   LHC energies,"C. Bal\'azs, E. L. Berger, P. M. Nadolsky, C.-P. Yuan","  A fully differential calculation in perturbative quantum chromodynamics is presented for the production of massive photon pairs at hadron colliders. All next-to-leading order perturbative contributions from quark-antiquark, gluon-(anti)quark, and gluon-gluon subprocesses are included, as well as all-orders resummation of initial-state gluon radiation valid at next-to-next-to-leading logarithmic accuracy. The region of phase space is specified in which the calculation is most reliable. Good agreement is demonstrated with data from the Fermilab Tevatron, and predictions are made for more detailed tests with CDF and DO data. Predictions are shown for distributions of diphoton pairs produced at the energy of the Large Hadron Collider (LHC). Distributions of the diphoton pairs from the decay of a Higgs boson are contrasted with those produced from QCD processes at the LHC, showing that enhanced sensitivity to the signal can be obtained with judicious selection of events. "
1,Sparsity-certifying Graph Decompositions,Ileana Streinu and Louis Theran,"  We describe a new algorithm, the $(k,\ell)$-pebble game with colors, and use it obtain a characterization of the family of $(k,\ell)$-sparse graphs and algorithmic solutions to a family of problems concerning tree decompositions of graphs. Special instances of sparse graphs appear in rigidity theory and have received increased attention in recent years. In particular, our colored pebbles generalize and strengthen the previous results of Lee and Streinu and give a new proof of the Tutte-Nash-Williams characterization of arboricity. We also present a new decomposition that certifies sparsity based on the $(k,\ell)$-pebble game with colors. Our work also exposes connections between pebble game algorithms and previous sparse graph algorithms by Gabow, Gabow and Westermann and Hendrickson. "
2,The evolution of the Earth-Moon system based on the dark matter field   fluid model,Hongjun Pan,"  The evolution of Earth-Moon system is described by the dark matter field fluid model proposed in the Meeting of Division of Particle and Field 2004, American Physical Society. The current behavior of the Earth-Moon system agrees with this model very well and the general pattern of the evolution of the Moon-Earth system described by this model agrees with geological and fossil evidence. The closest distance of the Moon to Earth was about 259000 km at 4.5 billion years ago, which is far beyond the Roche's limit. The result suggests that the tidal friction may not be the primary cause for the evolution of the Earth-Moon system. The average dark matter field fluid constant derived from Earth-Moon system data is 4.39 x 10^(-22) s^(-1)m^(-1). This model predicts that the Mars's rotation is also slowing with the angular acceleration rate about -4.38 x 10^(-22) rad s^(-2). "
3,A determinant of Stirling cycle numbers counts unlabeled acyclic   single-source automata,David Callan,  We show that a determinant of Stirling cycle numbers counts unlabeled acyclic single-source automata. The proof involves a bijection from these automata to certain marked lattice paths and a sign-reversing involution to evaluate the determinant. 
4,From dyadic $\Lambda_{\alpha}$ to $\Lambda_{\alpha}$,Wael Abu-Shammala and Alberto Torchinsky,"  In this paper we show how to compute the $\Lambda_{\alpha}$ norm, $\alpha\ge 0$, using the dyadic grid. This result is a consequence of the description of the Hardy spaces $H^p(R^N)$ in terms of dyadic and special atoms. "
5,Bosonic characters of atomic Cooper pairs across resonance,Y. H. Pong and C. K. Law,"  We study the two-particle wave function of paired atoms in a Fermi gas with tunable interaction strengths controlled by Feshbach resonance. The Cooper pair wave function is examined for its bosonic characters, which is quantified by the correction of Bose enhancement factor associated with the creation and annihilation composite particle operators. An example is given for a three-dimensional uniform gas. Two definitions of Cooper pair wave function are examined. One of which is chosen to reflect the off-diagonal long range order (ODLRO). Another one corresponds to a pair projection of a BCS state. On the side with negative scattering length, we found that paired atoms described by ODLRO are more bosonic than the pair projected definition. It is also found that at $(k_F a)^{-1} \ge 1$, both definitions give similar results, where more than 90% of the atoms occupy the corresponding molecular condensates. "
6,Polymer Quantum Mechanics and its Continuum Limit,"Alejandro Corichi, Tatjana Vukasinac and Jose A. Zapata","  A rather non-standard quantum representation of the canonical commutation relations of quantum mechanics systems, known as the polymer representation has gained some attention in recent years, due to its possible relation with Planck scale physics. In particular, this approach has been followed in a symmetric sector of loop quantum gravity known as loop quantum cosmology. Here we explore different aspects of the relation between the ordinary Schroedinger theory and the polymer description. The paper has two parts. In the first one, we derive the polymer quantum mechanics starting from the ordinary Schroedinger theory and show that the polymer description arises as an appropriate limit. In the second part we consider the continuum limit of this theory, namely, the reverse process in which one starts from the discrete theory and tries to recover back the ordinary Schroedinger quantum mechanics. We consider several examples of interest, including the harmonic oscillator, the free particle and a simple cosmological model. "
7,Numerical solution of shock and ramp compression for general material   properties,Damian C. Swift,"  A general formulation was developed to represent material models for applications in dynamic loading. Numerical methods were devised to calculate response to shock and ramp compression, and ramp decompression, generalizing previous solutions for scalar equations of state. The numerical methods were found to be flexible and robust, and matched analytic results to a high accuracy. The basic ramp and shock solution methods were coupled to solve for composite deformation paths, such as shock-induced impacts, and shock interactions with a planar interface between different materials. These calculations capture much of the physics of typical material dynamics experiments, without requiring spatially-resolving simulations. Example calculations were made of loading histories in metals, illustrating the effects of plastic work on the temperatures induced in quasi-isentropic and shock-release experiments, and the effect of a phase transition. "
8,"The Spitzer c2d Survey of Large, Nearby, Insterstellar Clouds. IX. The   Serpens YSO Population As Observed With IRAC and MIPS","Paul Harvey, Bruno Merin, Tracy L. Huard, Luisa M. Rebull, Nicholas   Chapman, Neal J. Evans II, Philip C. Myers","  We discuss the results from the combined IRAC and MIPS c2d Spitzer Legacy observations of the Serpens star-forming region. In particular we present a set of criteria for isolating bona fide young stellar objects, YSO's, from the extensive background contamination by extra-galactic objects. We then discuss the properties of the resulting high confidence set of YSO's. We find 235 such objects in the 0.85 deg^2 field that was covered with both IRAC and MIPS. An additional set of 51 lower confidence YSO's outside this area is identified from the MIPS data combined with 2MASS photometry. We describe two sets of results, color-color diagrams to compare our observed source properties with those of theoretical models for star/disk/envelope systems and our own modeling of the subset of our objects that appear to be star+disks. These objects exhibit a very wide range of disk properties, from many that can be fit with actively accreting disks to some with both passive disks and even possibly debris disks. We find that the luminosity function of YSO's in Serpens extends down to at least a few x .001 Lsun or lower for an assumed distance of 260 pc. The lower limit may be set by our inability to distinguish YSO's from extra-galactic sources more than by the lack of YSO's at very low luminosities. A spatial clustering analysis shows that the nominally less-evolved YSO's are more highly clustered than the later stages and that the background extra-galactic population can be fit by the same two-point correlation function as seen in other extra-galactic studies. We also present a table of matches between several previous infrared and X-ray studies of the Serpens YSO population and our Spitzer data set. "
9,"Partial cubes: structures, characterizations, and constructions",Sergei Ovchinnikov,"  Partial cubes are isometric subgraphs of hypercubes. Structures on a graph defined by means of semicubes, and Djokovi\'{c}'s and Winkler's relations play an important role in the theory of partial cubes. These structures are employed in the paper to characterize bipartite graphs and partial cubes of arbitrary dimension. New characterizations are established and new proofs of some known results are given.   The operations of Cartesian product and pasting, and expansion and contraction processes are utilized in the paper to construct new partial cubes from old ones. In particular, the isometric and lattice dimensions of finite partial cubes obtained by means of these operations are calculated. "
10,Computing genus 2 Hilbert-Siegel modular forms over $\Q(\sqrt{5})$ via   the Jacquet-Langlands correspondence,Clifton Cunningham and Lassina Dembele,"  In this paper we present an algorithm for computing Hecke eigensystems of Hilbert-Siegel cusp forms over real quadratic fields of narrow class number one. We give some illustrative examples using the quadratic field $\Q(\sqrt{5})$. In those examples, we identify Hilbert-Siegel eigenforms that are possible lifts from Hilbert eigenforms. "
11,Distribution of integral Fourier Coefficients of a Modular Form of Half   Integral Weight Modulo Primes,Dohoon Choi,"  Recently, Bruinier and Ono classified cusp forms $f(z) := \sum_{n=0}^{\infty} a_f(n)q ^n \in S_{\lambda+1/2}(\Gamma_0(N),\chi)\cap \mathbb{Z}[[q]]$ that does not satisfy a certain distribution property for modulo odd primes $p$. In this paper, using Rankin-Cohen Bracket, we extend this result to modular forms of half integral weight for primes $p \geq 5$. As applications of our main theorem we derive distribution properties, for modulo primes $p\geq5$, of traces of singular moduli and Hurwitz class number. We also study an analogue of Newman's conjecture for overpartitions. "
12,$p$-adic Limit of Weakly Holomorphic Modular Forms of Half Integral   Weight,Dohoon Choi and YoungJu Choie,"  Serre obtained the p-adic limit of the integral Fourier coefficient of modular forms on $SL_2(\mathbb{Z})$ for $p=2,3,5,7$. In this paper, we extend the result of Serre to weakly holomorphic modular forms of half integral weight on $\Gamma_{0}(4N)$ for $N=1,2,4$. A proof is based on linear relations among Fourier coefficients of modular forms of half integral weight. As applications we obtain congruences of Borcherds exponents, congruences of quotient of Eisentein series and congruences of values of $L$-functions at a certain point are also studied. Furthermore, the congruences of the Fourier coefficients of Siegel modular forms on Maass Space are obtained using Ikeda lifting. "
13,Iterated integral and the loop product,Koichi Fujii,  In this article we discuss a relation between the string topology and differential forms based on the theory of Chen's iterated integrals and the cyclic bar complex. 
14,Fermionic superstring loop amplitudes in the pure spinor formalism,Christian Stahn,"  The pure spinor formulation of the ten-dimensional superstring leads to manifestly supersymmetric loop amplitudes, expressed as integrals in pure spinor superspace. This paper explores different methods to evaluate these integrals and then uses them to calculate the kinematic factors of the one-loop and two-loop massless four-point amplitudes involving two and four Ramond states. "
15,Lifetime of doubly charmed baryons,"Chao-Hsi Chang, Tong Li, Xue-Qian Li and Yu-Ming Wang","  In this work, we evaluate the lifetimes of the doubly charmed baryons $\Xi_{cc}^{+}$, $\Xi_{cc}^{++}$ and $\Omega_{cc}^{+}$. We carefully calculate the non-spectator contributions at the quark level where the Cabibbo-suppressed diagrams are also included. The hadronic matrix elements are evaluated in the simple non-relativistic harmonic oscillator model. Our numerical results are generally consistent with that obtained by other authors who used the diquark model. However, all the theoretical predictions on the lifetimes are one order larger than the upper limit set by the recent SELEX measurement. This discrepancy would be clarified by the future experiment, if more accurate experiment still confirms the value of the SELEX collaboration, there must be some unknown mechanism to be explored. "
16,Spectroscopic Observations of the Intermediate Polar EX Hydrae in   Quiescence,"Nceba Mhlahlo, David H. Buckley, Vikram S. Dhillon, Steven B. Potter,   Brian Warner and Patric A. Woudt","  Results from spectroscopic observations of the Intermediate Polar (IP) EX Hya in quiescence during 1991 and 2001 are presented. Spin-modulated radial velocities consistent with an outer disc origin were detected for the first time in an IP. The spin pulsation was modulated with velocities near ~500-600 km/s. These velocities are consistent with those of material circulating at the outer edge of the accretion disc, suggesting corotation of the accretion curtain with material near the Roche lobe radius. Furthermore, spin Doppler tomograms have revealed evidence of the accretion curtain emission extending from velocities of ~500 km/s to ~1000 km/s. These findings have confirmed the theoretical model predictions of King & Wynn (1999), Belle et al. (2002) and Norton et al. (2004) for EX Hya, which predict large accretion curtains that extend to a distance close to the Roche lobe radius in this system. Evidence for overflow stream of material falling onto the magnetosphere was observed, confirming the result of Belle et al. (2005) that disc overflow in EX Hya is present during quiescence as well as outburst. It appears that the hbeta and hgamma spin radial velocities originated from the rotation of the funnel at the outer disc edge, while those of halpha were produced due to the flow of material along the field lines far from the white dwarf (narrow component) and close to the white dwarf (broad-base component), in agreement with the accretion curtain model. "
17,In quest of a generalized Callias index theorem,Andreas Gustavsson,"  We give a prescription for how to compute the Callias index, using as regulator an exponential function. We find agreement with old results in all odd dimensions. We show that the problem of computing the dimension of the moduli space of self-dual strings can be formulated as an index problem in even-dimensional (loop-)space. We think that the regulator used in this Letter can be applied to this index problem. "
18,"Approximation for extinction probability of the contact process based on   the Gr\""obner basis",Norio Konno,"  In this note we give a new method for getting a series of approximations for the extinction probability of the one-dimensional contact process by using the Gr\""obner basis. "
19,Measurement of the Hadronic Form Factor in D0 --> K- e+ nue Decays,"The BABAR Collaboration, B. Aubert, et al","  The shape of the hadronic form factor f+(q2) in the decay D0 --> K- e+ nue has been measured in a model independent analysis and compared with theoretical calculations. We use 75 fb(-1) of data recorded by the BABAR detector at the PEPII electron-positron collider. The corresponding decay branching fraction, relative to the decay D0 --> K- pi+, has also been measured to be RD = BR(D0 --> K- e+ nue)/BR(D0 --> K- pi+) = 0.927 +/- 0.007 +/- 0.012. From these results, and using the present world average value for BR(D0 --> K- pi+), the normalization of the form factor at q2=0 is determined to be f+(0)=0.727 +/- 0.007 +/- 0.005 +/- 0.007 where the uncertainties are statistical, systematic, and from external inputs, respectively. "
20,Molecular Synchronization Waves in Arrays of Allosterically Regulated   Enzymes,"Vanessa Casagrande, Yuichi Togashi, Alexander S. Mikhailov",  Spatiotemporal pattern formation in a product-activated enzymic reaction at high enzyme concentrations is investigated. Stochastic simulations show that catalytic turnover cycles of individual enzymes can become coherent and that complex wave patterns of molecular synchronization can develop. The analysis based on the mean-field approximation indicates that the observed patterns result from the presence of Hopf and wave bifurcations in the considered system. 
21,Stochastic Lie group integrators,Simon J.A. Malham and Anke Wiese,"  We present Lie group integrators for nonlinear stochastic differential equations with non-commutative vector fields whose solution evolves on a smooth finite dimensional manifold. Given a Lie group action that generates transport along the manifold, we pull back the stochastic flow on the manifold to the Lie group via the action, and subsequently pull back the flow to the corresponding Lie algebra via the exponential map. We construct an approximation to the stochastic flow in the Lie algebra via closed operations and then push back to the Lie group and then to the manifold, thus ensuring our approximation lies in the manifold. We call such schemes stochastic Munthe-Kaas methods after their deterministic counterparts. We also present stochastic Lie group integration schemes based on Castell--Gaines methods. These involve using an underlying ordinary differential integrator to approximate the flow generated by a truncated stochastic exponential Lie series. They become stochastic Lie group integrator schemes if we use Munthe-Kaas methods as the underlying ordinary differential integrator. Further, we show that some Castell--Gaines methods are uniformly more accurate than the corresponding stochastic Taylor schemes. Lastly we demonstrate our methods by simulating the dynamics of a free rigid body such as a satellite and an autonomous underwater vehicle both perturbed by two independent multiplicative stochastic noise processes. "
22,ALMA as the ideal probe of the solar chromosphere,"M. A. Loukitcheva, S. K. Solanki and S. White","  The very nature of the solar chromosphere, its structuring and dynamics, remains far from being properly understood, in spite of intensive research. Here we point out the potential of chromospheric observations at millimeter wavelengths to resolve this long-standing problem. Computations carried out with a sophisticated dynamic model of the solar chromosphere due to Carlsson and Stein demonstrate that millimeter emission is extremely sensitive to dynamic processes in the chromosphere and the appropriate wavelengths to look for dynamic signatures are in the range 0.8-5.0 mm. The model also suggests that high resolution observations at mm wavelengths, as will be provided by ALMA, will have the unique property of reacting to both the hot and the cool gas, and thus will have the potential of distinguishing between rival models of the solar atmosphere. Thus, initial results obtained from the observations of the quiet Sun at 3.5 mm with the BIMA array (resolution of 12 arcsec) reveal significant oscillations with amplitudes of 50-150 K and frequencies of 1.5-8 mHz with a tendency toward short-period oscillations in internetwork and longer periods in network regions. However higher spatial resolution, such as that provided by ALMA, is required for a clean separation between the features within the solar atmosphere and for an adequate comparison with the output of the comprehensive dynamic simulations. "
23,Formation of quasi-solitons in transverse confined ferromagnetic film   media,"A.A. Serga, M. Kostylev, and B. Hillebrands","  The formation of quasi-2D spin-wave waveforms in longitudinally magnetized stripes of ferrimagnetic film was observed by using time- and space-resolved Brillouin light scattering technique. In the linear regime it was found that the confinement decreases the amplitude of dynamic magnetization near the lateral stripe edges. Thus, the so-called effective dipolar pinning of dynamic magnetization takes place at the edges.   In the nonlinear regime a new stable spin wave packet propagating along a waveguide structure, for which both transversal instability and interaction with the side walls of the waveguide are important was observed. The experiments and a numerical simulation of the pulse evolution show that the shape of the formed waveforms and their behavior are strongly influenced by the confinement. "
24,Spectroscopic Properties of Polarons in Strongly Correlated Systems by   Exact Diagrammatic Monte Carlo Method,"A. S. Mishchenko (1 and 2) and N. Nagaosa (1 and 3) ((1) CREST, Japan   Science and Technology Agency, (2) Russian Research Centre ``Kurchatov   Institute'', (3) The University of Tokyo)","  We present recent advances in understanding of the ground and excited states of the electron-phonon coupled systems obtained by novel methods of Diagrammatic Monte Carlo and Stochastic Optimization, which enable the approximation-free calculation of Matsubara Green function in imaginary times and perform unbiased analytic continuation to real frequencies. We present exact numeric results on the ground state properties, Lehmann spectral function and optical conductivity of different strongly correlated systems: Frohlich polaron, Rashba-Pekar exciton-polaron, pseudo Jahn-Teller polaron, exciton, and interacting with phonons hole in the t-J model. "
25,"Placeholder Substructures II: Meta-Fractals, Made of Box-Kites, Fill   Infinite-Dimensional Skies",Robert P. C. de Marrais,"  Zero-divisors (ZDs) derived by Cayley-Dickson Process (CDP) from N-dimensional hypercomplex numbers (N a power of 2, at least 4) can represent singularities and, as N approaches infinite, fractals -- and thereby,scale-free networks. Any integer greater than 8 and not a power of 2 generates a meta-fractal or ""Sky"" when it is interpreted as the ""strut constant"" (S) of an ensemble of octahedral vertex figures called ""Box-Kites"" (the fundamental building blocks of ZDs). Remarkably simple bit-manipulation rules or ""recipes"" provide tools for transforming one fractal genus into others within the context of Wolfram's Class 4 complexity. "
26,Filling-Factor-Dependent Magnetophonon Resonance in Graphene,"M. O. Goerbig, J.-N. Fuchs, K. Kechedzhi, Vladimir I. Fal'ko","  We describe a peculiar fine structure acquired by the in-plane optical phonon at the Gamma-point in graphene when it is brought into resonance with one of the inter-Landau-level transitions in this material. The effect is most pronounced when this lattice mode (associated with the G-band in graphene Raman spectrum) is in resonance with inter-Landau-level transitions 0 -> (+,1) and (-,1) -> 0, at a magnetic field B_0 ~ 30 T. It can be used to measure the strength of the electron-phonon coupling directly, and its filling-factor dependence can be used experimentally to detect circularly polarized lattice modes. "
27,"Pfaffians, hafnians and products of real linear functionals",P\'eter E. Frenkel,  We prove pfaffian and hafnian versions of Lieb's inequalities on determinants and permanents of positive semi-definite matrices. We use the hafnian inequality to improve the lower bound of R\'ev\'esz and Sarantopoulos on the norm of a product of linear functionals on a real Euclidean space (this subject is sometimes called the `real linear polarization constant' problem). 
28,Understanding the Flavor Symmetry Breaking and Nucleon Flavor-Spin   Structure within Chiral Quark Model,"Zhan Shu, Xiao-Lin Chen and Wei-Zhen Deng","  In $\XQM$, a quark can emit Goldstone bosons. The flavor symmetry breaking in the Goldstone boson emission process is used to intepret the nucleon flavor-spin structure. In this paper, we study the inner structure of constituent quarks implied in $\XQM$ caused by the Goldstone boson emission process in nucleon. From a simplified model Hamiltonian derived from $\XQM$, the intrinsic wave functions of constituent quarks are determined. Then the obtained transition probabilities of the emission of Goldstone boson from a quark can give a reasonable interpretation to the flavor symmetry breaking in nucleon flavor-spin structure. "
29,Tuning correlation effects with electron-phonon interactions,J.P.Hague and N.d'Ambrumenil,"  We investigate the effect of tuning the phonon energy on the correlation effects in models of electron-phonon interactions using DMFT. In the regime where itinerant electrons, instantaneous electron-phonon driven correlations and static distortions compete on similar energy scales, we find several interesting results including (1) A crossover from band to Mott behavior in the spectral function, leading to hybrid band/Mott features in the spectral function for phonon frequencies slightly larger than the band width. (2) Since the optical conductivity depends sensitively on the form of the spectral function, we show that such a regime should be observable through the low frequency form of the optical conductivity. (3) The resistivity has a double kondo peak arrangement "
