,title,authors,abstract
225,Correlated modulation between the redshifted Fe K alpha line and the   continuum emission in NGC 3783,"F. Tombesi (1,2), B. De Marco (3), K. Iwasawa (4), M. Cappi (1), M.   Dadina (1), G. Ponti (1,2), G. Miniutti (5) and G.G.C. Palumbo (2) ((1)   INAF-IASF Bologna, (2) UNIBO, (3) SISSA, (4) MPE, (5) Institute of Astronomy,   Cambridge)","  It has been suggested that X-ray observations of rapidly variable Seyfert galaxies may hold the key to probe the gas orbital motions in the innermost regions of accretion discs around black holes and, thus, trace flow patterns under the effect of the hole strong gravitational field. We explore this possibility analizing XMM-Newton observations of the seyfert 1 galaxy NGC 3783. A detiled time-resolved spectral analysis is performed down to the shortest possible time-scales (few ks) using ""excess maps"" and cross-correlating light curves in different energy bands. In addition to a constant core of the Fe K alpha line, we detected a variable and redshifted Fe K alpha emission feature between 5.3-6.1 keV. The line exhibits a modulation on a time-scale of 27 ks that is similar to and in phase with a modulation of the 0.3-10 keV source continuum. The time-scale of the correlated variability of the redshifted Fe line and continuum agrees with the local dynamical time-scale of the accretion disc at 10 r_g around a black hole of 10^7 M_sun. Given the shape of the redshfted line emission and the overall X-ray variability pattern, the line is likely to arise from the relativistic region near the black hole. "
226,Isotopic Effects in Nuclear Reactions at Relativistic Energies,"C.Sfienti, M. De Napoli, S. Bianchin, A.S. Botvina, J. Brzychczyk, A.   Le Fevre, J. Lukasik, P. Pawlowski, W. Trautmann and the ALADiN2000   Collaboration","  A systematic study of isotopic effects in the break-up of projectile spectators at relativistic energies has been performed at the GSI laboratory with the ALADiN spectrometer coupled to the LAND neutron detector. Besides a primary beam of 124Sn, also secondary beams of 124La and 107Sn produced at the FRS fragment separator have been used in order to extend the range of isotopic compositions. The gross properties of projectile fragmentation are very similar for all the studied systems but specific isotopic effects have been observed in both neutron and charged particle production. The breakup temperatures obtained from the double ratios of isotopic yields have been extracted and compared with the limiting-temperature expectation. "
227,"Einstein vs Maxwell: Is gravitation a curvature of space, a field in   flat space, or both?",Theo M. Nieuwenhuizen,"  Starting with a field theoretic approach in Minkowski space, the gravitational energy momentum tensor is derived from the Einstein equations in a straightforward manner. This allows to present them as {\it acceleration tensor} = const. $\times$ {\it total energy momentum tensor}. For flat space cosmology the gravitational energy is negative and cancels the material energy. In the relativistic theory of gravitation a bimetric coupling between the Riemann and Minkowski metrics breaks general coordinate invariance. The case of a positive cosmological constant is considered. A singularity free version of the Schwarzschild black hole is solved analytically. In the interior the components of the metric tensor quickly die out, but do not change sign, leaving the role of time as usual. For cosmology the $\Lambda$CDM model is covered, while there appears a form of inflation at early times. Here both the total energy and the zero point energy vanish. "
228,Geometric Complexity Theory VI: the flip via saturated and positive   integer programming in representation theory and algebraic geometry,Ketan D. Mulmuley,"  This article belongs to a series on geometric complexity theory (GCT), an approach to the P vs. NP and related problems through algebraic geometry and representation theory. The basic principle behind this approach is called the flip. In essence, it reduces the negative hypothesis in complexity theory (the lower bound problems), such as the P vs. NP problem in characteristic zero, to the positive hypothesis in complexity theory (the upper bound problems): specifically, to showing that the problems of deciding nonvanishing of the fundamental structural constants in representation theory and algebraic geometry, such as the well known plethysm constants--or rather certain relaxed forms of these decision probelms--belong to the complexity class P. In this article, we suggest a plan for implementing the flip, i.e., for showing that these relaxed decision problems belong to P. This is based on the reduction of the preceding complexity-theoretic positive hypotheses to mathematical positivity hypotheses: specifically, to showing that there exist positive formulae--i.e. formulae with nonnegative coefficients--for the structural constants under consideration and certain functions associated with them. These turn out be intimately related to the similar positivity properties of the Kazhdan-Lusztig polynomials and the multiplicative structural constants of the canonical (global crystal) bases in the theory of Drinfeld-Jimbo quantum groups. The known proofs of these positivity properties depend on the Riemann hypothesis over finite fields and the related results. Thus the reduction here, in conjunction with the flip, in essence, says that the validity of the P vs. NP conjecture in characteristic zero is intimately linked to the Riemann hypothesis over finite fields and related problems. "
229,Two new basaltic asteroids in the Outer Main Belt?,R. Duffard and F. Roig,"  The identification of basaltic asteroids in the asteroid Main Belt and the description of their surface mineralogy is necessary to understand the diversity in the collection of basaltic meteorites. Basaltic asteroids can be identified from their visible reflectance spectra and are classified as V-type in the usual taxonomies. In this work, we report visible spectroscopic observations of two candidate V-type asteroids, (7472) Kumakiri and (10537) 1991 RY16, located in the outer Main Belt (a > 2.85 UA). These candidate have been previously identified by Roig and Gil-Hutton (2006, Icarus 183, 411) using the Sloan Digital Sky Survey colors. The spectroscopic observations have been obtained at the Calar Alto Observatory, Spain, during observational runs in November and December 2006. The spectra of these two asteroids show the steep slope shortwards of 0.70 microns and the deep absorption feature longwards of 0.75 microns that are characteristic of V-type asteroids. However, the presence of a shallow but conspicuous absorption band around 0.65 microns opens some questions about the actual mineralogy of these two asteroids. Such band has never been observed before in basaltic asteroids with the intensity we detected it. We discuss the possibility for this shallow absorption feature to be caused by the presence of chromium on the asteroid surface. Our results indicate that, together with (1459) Magnya, asteroids (7472) Kumakiri and (10537) 1991 RY16 may be the only traces of basaltic material found up to now in the outer Main Belt. "
230,Interpolating and sampling sequences in finite Riemann surfaces,Joaquim Ortega-Cerda,  We provide a description of the interpolating and sampling sequences on a space of holomorphic functions with a uniform growth restriction defined on finite Riemann surfaces. 
231,New algebraic aspects of perturbative and non-perturbative Quantum Field   Theory,"Christoph Bergbauer, Dirk Kreimer","  In this expository article we review recent advances in our understanding of the combinatorial and algebraic structure of perturbation theory in terms of Feynman graphs, and Dyson-Schwinger equations. Starting from Lie and Hopf algebras of Feynman graphs, perturbative renormalization is rephrased algebraically. The Hochschild cohomology of these Hopf algebras leads the way to Slavnov-Taylor identities and Dyson-Schwinger equations. We discuss recent progress in solving simple Dyson-Schwinger equations in the high energy sector using the algebraic machinery. Finally there is a short account on a relation to algebraic geometry and number theory: understanding Feynman integrals as periods of mixed (Tate) motives. "
232,Many-body interband tunneling as a witness for complex dynamics in the   Bose-Hubbard model,"Andrea Tomadin, Riccardo Mannella, and Sandro Wimberger","  A perturbative model is studied for the tunneling of many-particle states from the ground band to the first excited energy band, mimicking Landau-Zener decay for ultracold, spinless atoms in quasi-one dimensional optical lattices subjected to a tunable tilting force. The distributions of the computed tunneling rates provide an independent and experimentally accessible signature of the regular-chaotic transition in the strongly correlated many-body dynamics of the ground band. "
233,"Comments on ``Are Swift Gamma-Ray Bursts consistent with the Ghirlanda   relation?"", by Campana et al.(astro--ph/0703676)","G. Ghirlanda (1), L. Nava (1,2), G. Ghisellini (1), C. Firmani (1,3)   ((1) Osserv. Astr. di Brera, (2) Univ. degli Studi dell'Insubria, (3)   U.N.A.M.)","  In their recent paper, Campana et al. (2007) found that 5 bursts, among those detected by Swift, are outliers with respect to the E_peak-E_gamma (""Ghirlanda"") correlation. We instead argue that they are not. "
234,The Determination of the Helicity of $W'$ Boson Couplings at the LHC,Thomas G. Rizzo,"  Apart from its mass and width, the most important property of a new charged gauge boson, $W'$, is the helicity of its couplings to the SM fermions. Such particles are expected to exist in many extensions of the Standard Model. In this paper we explore the capability of the LHC to determine the $W'$ coupling helicity at low integrated luminosities in the $\ell +E_T^{miss}$ discovery channel. We find that measurements of the transverse mass distribution, reconstructed from this final state in the $W-W'$ interference region, provides the best determination of this quantity. To make such measurements requires integrated luminosities of $\sim 10(60) fb^{-1}$ assuming $M_{W'}=1.5(2.5)$ TeV and provided that the $W'$ couplings have Standard Model magnitude. This helicity determination can be further strengthened by the use of various discovery channel leptonic asymmetries, also measured in the same interference regime, but with higher integrated luminosities. "
235,Curvature flows in semi-Riemannian manifolds,Claus Gerhardt,"  We prove that the limit hypersurfaces of converging curvature flows are stable, if the initial velocity has a weak sign, and give a survey of the existence and regularity results. "
236,Hydrodynamic and Spectral Simulations of HMXB Winds,"Christopher W. Mauche, Duane A. Liedahl, Shizuka Akiyama (Lawrence   Livermore Nat'l Lab.), Tomasz Plewa (University of Chicago)","  We describe preliminary results of a global model of the radiatively-driven photoionized wind and accretion flow of the high-mass X-ray binary Vela X-1. The full model combines FLASH hydrodynamic calculations, XSTAR photoionization calculations, HULLAC atomic data, and Monte Carlo radiation transport. We present maps of the density, temperature, velocity, and ionization parameter from a FLASH two-dimensional time-dependent simulation of Vela X-1, as well as maps of the emissivity distributions of the X-ray emission lines. "
237,Radio Astrometric Detection and Characterization of Extra-Solar Planets:   A White Paper Submitted to the NSF ExoPlanet Task Force,"Geoffrey C. Bower (Berkeley), Alberto Bolatto (Berkeley), Eric Ford   (CfA, Florida), Paul Kalas (Berkeley), Jim Ulvestad (NRAO)","  The extraordinary astrometric accuracy of radio interferometry creates an important and unique opportunity for the discovery and characterization of exo-planets. Currently, the Very Long Baseline Array can routinely achieve better than 100 microarcsecond accuracy, and can approach 10 microarcsecond with careful calibration. We describe here RIPL, the Radio Interferometric PLanet search, a new program with the VLBA and the Green Bank 100 m telescope that will survey 29 low-mass, active stars over 3 years with sub-Jovian planet mass sensitivity at 1 AU. An upgrade of the VLBA bandwidth will increase astrometric accuracy by an order of magnitude. Ultimately, the colossal collecting area of the Square Kilometer Array could push astrometric accuracy to 1 microarcsecond, making detection and characterizaiton of Earth mass planets possible.   RIPL and other future radio astrometric planet searches occupy a unique volume in planet discovery and characterization parameter space. The parameter space of astrometric searches gives greater sensitivity to planets at large radii than radial velocity searches. For the VLBA and the expanded VLBA, the targets of radio astrometric surveys are by necessity nearby, low-mass, active stars, which cannot be studied efficiently through the radial velocity method, coronagraphy, or optical interferometry. For the SKA, detection sensitivity will extend to solar-type stars. Planets discovered through radio astrometric methods will be suitable for characterization through extreme adaptive optics.   The complementarity of radio astrometric techniques with other methods demonstrates that radio astrometry can play an important role in the roadmap for exoplanet discovery and characterization. "
238,Interface dynamics of microscopic cavities in water,Joachim Dzubiella,"  An analytical description of the interface motion of a collapsing nanometer-sized spherical cavity in water is presented by a modification of the Rayleigh-Plesset equation in conjunction with explicit solvent molecular dynamics simulations. Quantitative agreement is found between the two approaches for the time-dependent cavity radius $R(t)$ at different solvent conditions while in the continuum picture the solvent viscosity has to be corrected for curvature effects. The typical magnitude of the interface or collapse velocity is found to be given by the ratio of surface tension and fluid viscosity, $v\simeq\gamma/\eta$, while the curvature correction accelerates collapse dynamics on length scales below the equilibrium crossover scales ($\sim$1nm). The study offers a starting point for an efficient implicit modeling of water dynamics in aqueous nanoassembly and protein systems in nonequilibrium. "
239,"Viscosity, Black Holes, and Quantum Field Theory","D. T. Son, A. O. Starinets","  We review recent progress in applying the AdS/CFT correspondence to finite-temperature field theory. In particular, we show how the hydrodynamic behavior of field theory is reflected in the low-momentum limit of correlation functions computed through a real-time AdS/CFT prescription, which we formulate. We also show how the hydrodynamic modes in field theory correspond to the low-lying quasinormal modes of the AdS black p-brane metric. We provide a proof of the universality of the viscosity/entropy ratio within a class of theories with gravity duals and formulate a viscosity bound conjecture. Possible implications for real systems are mentioned. "
240,Superconducting states of the quasi-2D Holstein model: Effects of vertex   and non-local corrections,J.P.Hague,"  I investigate superconducting states in a quasi-2D Holstein model using the dynamical cluster approximation (DCA). The effects of spatial fluctuations (non-local corrections) are examined and approximations neglecting and incorporating lowest-order vertex corrections are computed. The approximation is expected to be valid for electron-phonon couplings of less than the bandwidth. The phase diagram and superconducting order parameter are calculated. Effects which can only be attributed to theories beyond Migdal--Eliashberg theory are present. In particular, the order parameter shows momentum dependence on the Fermi-surface with a modulated form and s-wave order is suppressed at half-filling. The results are discussed in relation to Hohenberg's theorem and the BCS approximation. "
241,Masers and star formation,Vincent L. Fish (NRAO),  Recent observational and theoretical advances concerning astronomical masers in star forming regions are reviewed. Major masing species are considered individually and in combination. Key results are summarized with emphasis on present science and future prospects. 
242,Renormalized quasiparticles in antiferromagnetic states of the Hubbard   model,J. Bauer and A.C. Hewson,"  We analyze the properties of the quasiparticle excitations of metallic antiferromagnetic states in a strongly correlated electron system. The study is based on dynamical mean field theory (DMFT) for the infinite dimensional Hubbard model with antiferromagnetic symmetry breaking. Self-consistent solutions of the DMFT equations are calculated using the numerical renormalization group (NRG). The low energy behavior in these results is then analyzed in terms of renormalized quasiparticles. The parameters for these quasiparticles are calculated directly from the NRG derived self-energy, and also from the low energy fixed point of the effective impurity. They are found to be in good agreement. We show that the main low energy features of the $\bf k$-resolved spectral density can be understood in terms of the quasiparticle picture. We also find that Luttinger's theorem is satisfied for the total electron number in the doped antiferromagnetic state. "
243,Comparison of exact-exchange calculations for solids in   current-spin-density- and spin-density-functional theory,"S. Sharma (1,2), S. Pittalis (2), S. Kurth (2), S. Shallcross (3), J.   K. Dewhurst (4) and E. K. U. Gross (2)","  The relative merits of current-spin-density- and spin-density-functional theory are investigated for solids treated within the exact-exchange-only approximation. Spin-orbit splittings and orbital magnetic moments are determined at zero external magnetic field. We find that for magnetic (Fe, Co and Ni) and non-magnetic (Si and Ge) solids, the exact-exchange current-spin-density functional approach does not significantly improve the accuracy of the corresponding spin-density functional results. "
244,One-loop MHV Rules and Pure Yang-Mills,"Andreas Brandhuber, Bill Spence, Gabriele Travaglini, Konstantinos   Zoubos","  It has been known for some time that the standard MHV diagram formulation of perturbative Yang-Mills theory is incomplete, as it misses rational terms in one-loop scattering amplitudes of pure Yang-Mills. We propose that certain Lorentz violating counterterms, when expressed in the field variables which give rise to standard MHV vertices, produce precisely these missing terms. These counterterms appear when Yang-Mills is treated with a regulator, introduced by Thorn and collaborators, which arises in worldsheet formulations of Yang-Mills theory in the lightcone gauge. As an illustration of our proposal, we show that a simple one-loop, two-point counterterm is the generating function for the infinite sequence of one-loop, all-plus helicity amplitudes in pure Yang-Mills, in complete agreement with known expressions. "
245,Fermi-liquid effects in the transresistivity in quantum Hall double   layers near $\nu= 1/2 $,Natalya A. Zimbovskaya,"  Here, we present theoretical studies of the temperature and magnetic field dependences of the Coulomb drag transresistivity between two parallel layers of two dimensional electron gases in quantum Hall regime near half filling of the lowest Landau level. It is shown that Fermi-liquid interactions between the relevant quasiparticles could give a significant effect on the transresistivity, providing its independence of the interlayer spacing for spacings taking on values reported in the experiments. Obtained results agree with the experimental evidence. "
246,Geometry of four-dimensional Killing spinors,"S. L. Cacciatori, M. M. Caldarelli, D. Klemm, D. S. Mansi, D. Roest","  The supersymmetric solutions of N=2, D=4 minimal ungauged and gauged supergravity are classified according to the fraction of preserved supersymmetry using spinorial geometry techniques. Subject to a reasonable assumption in the 1/2-supersymmetric time-like case of the gauged theory, we derive the complete form of all supersymmetric solutions. This includes a number of new 1/4- and 1/2-supersymmetric possibilities, like gravitational waves on bubbles of nothing in AdS_4. "
247,A Rigorous Time-Domain Analysis of Full--Wave Electromagnetic Cloaking   (Invisibility),Ricardo Weder,"  There is currently a great deal of interest in the theoretical and practical possibility of cloaking objects from the observation by electromagnetic waves. The basic idea of these invisibility devices \cite{glu1, glu2, le},\cite{pss1} is to use anisotropic {\it transformation media} whose permittivity and permeability $\var^{\lambda\nu}, \mu^{\lambda\nu}$, are obtained from the ones, $\var_0^{\lambda\nu}, \mu^{\lambda\nu}_0$, of isotropic media, by singular transformations of coordinates. In this paper we study electromagnetic cloaking in the time-domain using the formalism of time-dependent scattering theory. This formalism allows us to settle in an unambiguous way the mathematical problems posed by the singularities of the inverse of the permittivity and the permeability of the {\it transformation media} on the boundary of the cloaked objects. We write Maxwell's equations in Schr\""odinger form with the electromagnetic propagator playing the role of the Hamiltonian. We prove that the electromagnetic propagator outside of the cloaked objects is essentially self-adjoint. Moreover, the unique self-adjoint extension is unitarily equivalent to the electromagnetic propagator in the medium $\var_0^{\lambda\nu}, \mu^{\lambda\nu}_0$. Using this fact, and since the coordinate transformation is the identity outside of a ball, we prove that the scattering operator is the identity. Our results give a rigorous proof that the construction of \cite{glu1, glu2, le}, \cite{pss1} perfectly cloaks passive and active devices from observation by electromagnetic waves. Furthermore, we prove cloaking for general anisotropic materials. In particular, our results prove that it is possible to cloak objects inside general crystals. "
248,Non-perturbative conserving approximations and Luttinger's sum rule,"Jutta Ortloff, Matthias Balzer, Michael Potthoff",  Weak-coupling conserving approximations can be constructed by truncations of the Luttinger-Ward functional and are well known as thermodynamically consistent approaches which respect macroscopic conservation laws as well as certain sum rules at zero temperature. These properties can also be shown for variational approximations that are generated within the framework of the self-energy-functional theory without a truncation of the diagram series. Luttinger's sum rule represents an exception. We analyze the conditions under which the sum rule holds within a non-perturbative conserving approximation. Numerical examples are given for a simple but non-trivial dynamical two-site approximation. The validity of the sum rule for finite Hubbard clusters and the consequences for cluster extensions of the dynamical mean-field theory are discussed. 
249,2D-MIT as self-doping of a Wigner-Mott insulator,S. Pankov and V. Dobrosavljevic,"  We consider an interaction-driven scenario for the two-dimensional metal-insulator transition in zero magnetic field (2D-MIT), based on melting the Wigner crystal through vacancy-interstitial pair formation. We show that the transition from the Wigner-Mott insulator to a heavy Fermi liquid emerges as an instability to self-doping, resembling conceptually the solid to normal liquid transition in He3. The resulting physical picture naturally explains many puzzling features of the 2D-MIT. "
250,Entanglement of Subspaces and Error Correcting Codes,"Gilad Gour, Nolan R. Wallach","  We introduce the notion of entanglement of subspaces as a measure that quantify the entanglement of bipartite states in a randomly selected subspace. We discuss its properties and in particular we show that for maximally entangled subspaces it is additive. Furthermore, we show that maximally entangled subspaces can play an important role in the study of quantum error correction codes. We discuss both degenerate and non-degenerate codes and show that the subspace spanned by the logical codewords of a non-degenerate code is a 2k-totally (maximally) entangled subspace. As for non-degenerate codes, we provide a mathematical definition in terms of subspaces and, as an example, we analyze Shor's nine qubits code in terms of 22 mutually orthogonal subspaces. "
251,Does the present data on B_s - bar B_s mixing rule out a large   enhancement in the branching ratio of B_s --> mu+ mu- ?,Ashutosh Kumar Alok and S. Uma Sankar,"  In this letter, we consider the constraints imposed by the recent measurement of B_s - bar B_s mixing on the new physics contribution to the rare decay B_s --> mu+ mu-. New physics in the form vector and axial-vector couplings is already severely constrained by the data on B --> (K,K*) mu+ mu-. Here, we show that B_s - bar B_s mixing data, together with the data on K0 - bar K0 mixing and K_L --> mu+ mu- decay rate, strongly constrain the scalar-pseudoscalar contribution to B_s --> mu+ mu-. We conclude that new physics can at best lead to a factor of 2 increase in the branching ratio of B_s --> mu+ mu- compared to its Standard Model expectation. "
