,title,authors,abstract
144,Singularity Resolution in Isotropic Loop Quantum Cosmology: Recent   Developments,Ghanashyam Date,"  Since the past Iagrg meeting in December 2004, new developments in loop quantum cosmology have taken place, especially with regards to the resolution of the Big Bang singularity in the isotropic models. The singularity resolution issue has been discussed in terms of physical quantities (expectation values of Dirac observables) and there is also an ``improved'' quantization of the Hamiltonian constraint. These developments are briefly discussed.   This is an expanded version of the review talk given at the 24$^{\mathrm{th}}$ IAGRG meeting in February 2007. "
145,Vortices in Bose-Einstein Condensates: Theory,"N. G. Parker, B. Jackson, A. M. Martin, and C. S. Adams","  Vortices are pervasive in nature, representing the breakdown of laminar fluid flow and hence playing a key role in turbulence. The fluid rotation associated with a vortex can be parameterized by the circulation $\Gamma=\oint {\rm d}{\bf r}\cdot{\bf v}({\bf r})$ about the vortex, where ${\bf v}({\bf r})$ is the fluid velocity field. While classical vortices can take any value of circulation, superfluids are irrotational, and any rotation or angular momentum is constrained to occur through vortices with quantized circulation. Quantized vortices also play a key role in the dissipation of transport in superfluids. In BECs quantized vortices have been observed in several forms, including single vortices, vortex lattices, and vortex pairs and rings. The recent observation of quantized vortices in a fermionic gas was taken as a clear signature of the underlying condensation and superfluidity of fermion pairs. In addition to BECs, quantized vortices also occur in superfluid Helium, nonlinear optics, and type-II superconductors. "
146,A POVM view of the ensemble approach to polarization optics,"Sudha, A. V. Gopala Rao, A. R. Usha Devi and A. K. Rajagopal","  Statistical ensemble formalism of Kim, Mandel and Wolf (J. Opt. Soc. Am. A 4, 433 (1987)) offers a realistic model for characterizing the effect of stochastic non-image forming optical media on the state of polarization of transmittedlight. With suitable choice of the Jones ensemble, various Mueller transformations - some of which have been unknown so far - are deduced. It is observed that the ensemble approach is formally identical to the positive operator valued measures (POVM) on the quantum density matrix. This observation, in combination with the recent suggestion by Ahnert and Payne (Phys. Rev. A 71, 012330, (2005)) - in the context of generalized quantum measurement on single photon polarization states - that linear optics elements can be employed in setting up all possible POVMs, enables us to propose a way of realizing different types of Mueller devices. "
147,Reexamination of spin decoherence in semiconductor quantum dots from   equation-of-motion approach,"J. H. Jiang, Y. Y. Wang, and M. W. Wu","  The longitudinal and transversal spin decoherence times, $T_1$ and $T_2$, in semiconductor quantum dots are investigated from equation-of-motion approach for different magnetic fields, quantum dot sizes, and temperatures. Various mechanisms, such as the hyperfine interaction with the surrounding nuclei, the Dresselhaus spin-orbit coupling together with the electron--bulk-phonon interaction, the $g$-factor fluctuations, the direct spin-phonon coupling due to the phonon-induced strain, and the coaction of the electron--bulk/surface-phonon interaction together with the hyperfine interaction are included. The relative contributions from these spin decoherence mechanisms are compared in detail. In our calculation, the spin-orbit coupling is included in each mechanism and is shown to have marked effect in most cases. The equation-of-motion approach is applied in studying both the spin relaxation time $T_1$ and the spin dephasing time $T_2$, either in Markovian or in non-Markovian limit. When many levels are involved at finite temperature, we demonstrate how to obtain the spin relaxation time from the Fermi Golden rule in the limit of weak spin-orbit coupling. However, at high temperature and/or for large spin-orbit coupling, one has to use the equation-of-motion approach when many levels are involved. Moreover, spin dephasing can be much more efficient than spin relaxation at high temperature, though the two only differs by a factor of two at low temperature. "
148,Construction of initial data for 3+1 numerical relativity,"Eric Gourgoulhon (LUTH, CNRS / Observatoire de Paris / Univ. Paris 7)","  This lecture is devoted to the problem of computing initial data for the Cauchy problem of 3+1 general relativity. The main task is to solve the constraint equations. The conformal technique, introduced by Lichnerowicz and enhanced by York, is presented. Two standard methods, the conformal transverse-traceless one and the conformal thin sandwich, are discussed and illustrated by some simple examples. Finally a short review regarding initial data for binary systems (black holes and neutron stars) is given. "
149,Magnetism and Thermodynamics of Spin-1/2 Heisenberg Diamond Chains in a   Magnetic Field,Bo Gu and Gang Su,"  The magnetic and thermodynamic properties of spin-1/2 Heisenberg diamond chains are investigated in three different cases: (a) J1, J2, J3>0 (frustrated); (b) J1, J3<0, J2>0 (frustrated); and (c) J1, J2>0, J3<0 (non-frustrated). The density matrix renormalization group (DMRG) technique is invoked to study the properties of the system in the ground state, while the transfer matrix renormalization group (TMRG) technique is applied to explore the thermodynamic properties. The local magnetic moments, spin correlation functions, and static structure factors are discussed in the ground state for the three cases. It is shown that the static structure factor S(q) shows peaks at wavevectors $q=a\pi /3$ (a=0,1,2,3,4,5) for different couplings in a zero magnetic field, which, however in the magnetic fields where the magnetization plateau with m=1/6 pertains, exhibits the peaks only at q=0, $2\pi /3$ and $4\pi /3$, which are found to be couplings-independent. The DMRG results of the zero-field static structure factor can be nicely fitted by a linear superposition of six modes, where two fitting equations are proposed. It is observed that the six modes are closely related to the low-lying excitations of the system. At finite temperatures, the double-peak structures of the susceptibility and specific heat against temperature are obtained, where the peak positions and heights are found to depend on the competition of the couplings. It is also uncovered that the XXZ anisotropy of F and AF couplings leads the system of case (c) to display quite different behaviors. In addition, the experimental data of the susceptibility, specific heat and magnetization for the compound Cu$_{3}$(CO$_{3}$)$_{2}$(OH)$_{2}$ are fairly compared with our TMRG results. "
150,Extraction of physical laws from joint experimental data,I. Grabec,"  The extraction of a physical law y=yo(x) from joint experimental data about x and y is treated. The joint, the marginal and the conditional probability density functions (PDF) are expressed by given data over an estimator whose kernel is the instrument scattering function. As an optimal estimator of yo(x) the conditional average is proposed. The analysis of its properties is based upon a new definition of prediction quality. The joint experimental information and the redundancy of joint measurements are expressed by the relative entropy. With the number of experiments the redundancy on average increases, while the experimental information converges to a certain limit value. The difference between this limit value and the experimental information at a finite number of data represents the discrepancy between the experimentally determined and the true properties of the phenomenon. The sum of the discrepancy measure and the redundancy is utilized as a cost function. By its minimum a reasonable number of data for the extraction of the law yo(x) is specified. The mutual information is defined by the marginal and the conditional PDFs of the variables. The ratio between mutual information and marginal information is used to indicate which variable is the independent one. The properties of the introduced statistics are demonstrated on deterministically and randomly related variables. "
151,Kinetic equation for finite systems of fermions with pairing,"V.I. Abrosimov, D.M. Brink, A.Dellafiore, F. Matera","  The solutions of the Wigner-transformed time-dependent Hartree--Fock--Bogoliubov equations are studied in the constant-$\Delta$ approximation. This approximation is known to violate particle-number conservation. As a consequence, the density fluctuation and the longitudinal response function given by this approximation contain spurious contributions. A simple prescription for restoring both local and global particle-number conservation is proposed. Explicit expressions for the eigenfrequencies of the correlated systems and for the density response function are derived and it is shown that the semiclassical analogous of the quantum single--particle spectrum has an excitation gap of $2\Delta$, in agreement with the quantum result. The collective response is studied for a simplified form of the residual interaction. "
152,Reciprocal Symmetry and Classical Discrete Oscillator Incorporating   Half-Integral Energy Levels,Mushfiq Ahmad,"  Classical oscillator differential equation is replaced by the corresponding (finite time) difference equation. The equation is, then, symmetrized so that it remains invariant under the change d going to -d, where d is the smallest span of time. This symmetric equation has solutions, which come in reciprocally related pairs. One member of a pair agrees with the classical solution and the other is an oscillating solution and does not converge to a limit as d goes to 0. This solution contributes to oscillator energy a term which is a multiple of half-integers. "
153,Hadrons in Medium -- Theory confronts experiment,"Fabian Eichstaedt, Stefan Leupold, Ulrich Mosel, Pascal Muehlich","  In this talk we briefly summarize our theoretical understanding of in-medium selfenergies of hadrons. With the special case of the $\omega$ meson we demonstrate that earlier calculations that predicted a significant lowering of the mass in medium are based on an incorrect treatment of the model Lagrangian; more consistent calculations lead to a significant broadening, but hardly any mass shift. We stress that the experimental reconstruction of hadron spectral functions from measured decay products always requires knowledge of the decay branching ratios which may also be strongly mass-dependent. It also requires a quantitatively reliable treatment of final state interactions which has to be part of any reliable theory. "
154,A computer program for fast non-LTE analysis of interstellar line   spectra,"Floris van der Tak (SRON Groningen), John Black (Onsala), Fredrik   Schoeier (Stockholm), David Jansen and Ewine van Dishoeck (Leiden)","  The large quantity and high quality of modern radio and infrared line observations require efficient modeling techniques to infer physical and chemical parameters such as temperature, density, and molecular abundances. We present a computer program to calculate the intensities of atomic and molecular lines produced in a uniform medium, based on statistical equilibrium calculations involving collisional and radiative processes and including radiation from background sources. Optical depth effects are treated with an escape probability method. The program is available on the World Wide Web at http://www.sron.rug.nl/~vdtak/radex/index.shtml . The program makes use of molecular data files maintained in the Leiden Atomic and Molecular Database (LAMDA), which will continue to be improved and expanded. The performance of the program is compared with more approximate and with more sophisticated methods. An Appendix provides diagnostic plots to estimate physical parameters from line intensity ratios of commonly observed molecules. This program should form an important tool in analyzing observations from current and future radio and infrared telescopes. "
155,Nonlinear force-free coronal magnetic field extrapolation scheme based   on the direct boundary integral formulation,"Han He, Huaning Wang",  This paper has been withdrawn by the authors. 
156,Alternative Approaches to the Equilibrium Properties of Hard-Sphere   Liquids,"M. Lopez de Haro, S. B. Yuste, and A. Santos","  An overview of some analytical approaches to the computation of the structural and thermodynamic properties of single component and multicomponent hard-sphere fluids is provided. For the structural properties, they yield a thermodynamically consistent formulation, thus improving and extending the known analytical results of the Percus-Yevick theory. Approximate expressions for the contact values of the radial distribution functions and the corresponding analytical equations of state are also discussed. Extensions of this methodology to related systems, such as sticky hard spheres and square-well fluids, as well as its use in connection with the perturbation theory of fluids are briefly addressed. "
157,Complexities of Human Promoter Sequences,"Fangcui Zhao, Huijie Yang, and Binghong Wang","  By means of the diffusion entropy approach, we detect the scale-invariance characteristics embedded in the 4737 human promoter sequences. The exponent for the scale-invariance is in a wide range of $[ {0.3,0.9} ]$, which centered at $\delta_c = 0.66$. The distribution of the exponent can be separated into left and right branches with respect to the maximum. The left and right branches are asymmetric and can be fitted exactly with Gaussian form with different widths, respectively. "
158,Evidence for an excitonic insulator phase in 1T-TiSe$_{2}$,"H. Cercellier, C. Monney, F. Clerc, C. Battaglia, L. Despont, M. G.   Garnier, H. Beck, L. Patthey, H. Berger, P. Aebi","  We present a new high-resolution angle-resolved photoemission study of 1\textit{T}-TiSe$_{2}$ in both, its room-temperature, normal phase and its low-temperature, charge-density wave phase. At low temperature the photoemission spectra are strongly modified, with large band renormalisations at high-symmetry points of the Brillouin zone and a very large transfer of spectral weight to backfolded bands. A theoretical calculation of the spectral function for an excitonic insulator phase reproduces the experimental features with very good agreement. This gives strong evidence in favour of the excitonic insulator scenario as a driving force for the charge-density wave transition in 1\textit{T}-TiSe$_{2}$. "
159,Oxygen-rich droplets and the enrichment of the ISM,"G. Stasinska, G. Tenorio-Tagle, M. Rodriguez, W. J. Henney","  We argue that the discrepancies observed in HII regions between abundances derived from optical recombination lines (ORLs) and collisionally excited lines (CELs) might well be the signature of a scenario of the enrichment of the interstellar medium (ISM) proposed by Tenorio-Tagle (1996). In this scenario, the fresh oxygen released during massive supernova explosions is confined within the hot superbubbles as long as supernovae continue to explode. Only after the last massive supernova explosion, the metal-rich gas starts cooling down and falls on the galaxy within metal-rich droplets. Full mixing of these metal-rich droplets and the ISM occurs during photoionization by the next generations of massive stars. During this process, the metal-rich droplets give rise to strong recombination lines of the metals, leading to the observed ORL-CEL discrepancy. (The full version of this work is submitted to Astronomy and Astrophysics.) "
160,Soft modes and NTE in Zn(CN)2 from Raman spectroscopy and first   principles calculations,"T. R. Ravindran, A. K. Arora, Sharat Chandra, M. C. Valsakumar and N.   V. Chandra Shekar","  We have studied Zn(CN)2 at high pressure using Raman spectroscopy, and report Gruneisen parameters of the soft phonons. The phonon frequencies and eigen vectors obtained from ab-initio calculations are used for the assignment of the observed phonon spectra. Out of the eleven zone-centre optical modes, six modes exhibit negative Gruneisen parameter. The calculations suggest that the soft phonons correspond to the librational and translational modes of CN rigid unit, with librational modes contributing more to thermal expansion. A rapid disordering of the lattice is found above 1.6 GPa from X-ray diffraction. "
161,Estimation of experimental data redundancy and related statistics,I. Grabec,"  Redundancy of experimental data is the basic statistic from which the complexity of a natural phenomenon and the proper number of experiments needed for its exploration can be estimated. The redundancy is expressed by the entropy of information pertaining to the probability density function of experimental variables. Since the calculation of entropy is inconvenient due to integration over a range of variables, an approximate expression for redundancy is derived that includes only a sum over the set of experimental data about these variables. The approximation makes feasible an efficient estimation of the redundancy of data along with the related experimental information and information cost function. From the experimental information the complexity of the phenomenon can be simply estimated, while the proper number of experiments needed for its exploration can be determined from the minimum of the cost function. The performance of the approximate estimation of these statistics is demonstrated on two-dimensional normally distributed random data. "
162,Effective potentials for quasicrystals from ab-initio data,"Peter Brommer and Franz G\""ahler (Institut f\""ur Theoretische und   Angewandte Physik, Universit\""at Stuttgart)","  Classical effective potentials are indispensable for any large-scale atomistic simulations, and the relevance of simulation results crucially depends on the quality of the potentials used. For complex alloys like quasicrystals, however, realistic effective potentials are practically inexistent. We report here on our efforts to develop effective potentials especially for quasicrystalline alloy systems. We use the so-called force matching method, in which the potential parameters are adapted so as to optimally reproduce the forces and energies in a set of suitably chosen reference configurations. These reference data are calculated with ab-initio methods. As a first application, EAM potentials for decagonal Al-Ni-Co, icosahedral Ca-Cd, and both icosahedral and decagonal Mg-Zn quasicrystals have been constructed. The influence of the potential range and degree of specialisation on the accuracy and other properties is discussed and compared. "
163,On smooth foliations with Morse singularities,Lilia Rosati,"  Let $M$ be a smooth manifold and let $\F$ be a codimension one, $C^\infty$ foliation on $M$, with isolated singularities of Morse type. The study and classification of pairs $(M,\F)$ is a challenging (and difficult) problem. In this setting, a classical result due to Reeb \cite{Reeb} states that a manifold admitting a foliation with exactly two center-type singularities is a sphere. In particular this is true if the foliation is given by a function. Along these lines a result due to Eells and Kuiper \cite{Ku-Ee} classify manifolds having a real-valued function admitting exactly three non-degenerate singular points. In the present paper, we prove a generalization of the above mentioned results. To do this, we first describe the possible arrangements of pairs of singularities and the corresponding codimension one invariant sets, and then we give an elimination procedure for suitable center-saddle and some saddle-saddle configurations (of consecutive indices). In the second part, we investigate if other classical results, such as Haefliger and Novikov (Compact Leaf) theorems, proved for regular foliations, still hold true in presence of singularities. At this purpose, in the singular set, $Sing(\F)$ of the foliation $\F$, we consider {\em{weakly stable}} components, that we define as those components admitting a neighborhood where all leaves are compact. If $Sing(\F)$ admits only weakly stable components, given by smoothly embedded curves diffeomorphic to $S^1$, we are able to extend Haefliger's theorem. Finally, the existence of a closed curve, transverse to the foliation, leads us to state a Novikov-type result. "
164,Frobenius-Schur indicators for semisimple Lie algebras,Mohammad Abu-Hamed and Shlomo Gelaki,"  Let g be a finite dimensional complex semisimple Lie algebra, and let V be a finite dimensional represenation of g. We give a closed formula for the mth Frobenius-Schur indicator, m>1, of V in representation-theoretic terms. We deduce that the indicators take integer values, and that for a large enough m, the mth indicator of V equals the dimension of the zero weight space of V. For the classical Lie algebras sl(n), so(2n), so(2n+1) and sp(2n), this is the case for m greater or equal to 2n-1, 4n-5, 4n-3 and 2n+1, respectively. "
165,Supersymmetry breaking metastable vacua in runaway quiver gauge theories,"Inaki Garcia-Etxebarria, Fouad Saad, Angel M. Uranga","  In this paper we consider quiver gauge theories with fractional branes whose infrared dynamics removes the classical supersymmetric vacua (DSB branes). We show that addition of flavors to these theories (via additional non-compact branes) leads to local meta-stable supersymmetry breaking minima, closely related to those of SQCD with massive flavors. We simplify the study of the one-loop lifting of the accidental classical flat directions by direct computation of the pseudomoduli masses via Feynman diagrams. This new approach allows to obtain analytic results for all these theories. This work extends the results for the $dP_1$ theory in hep-th/0607218. The new approach allows to generalize the computation to general examples of DSB branes, and for arbitrary values of the superpotential couplings. "
166,Low Energy Aspects of Heavy Meson Decays,Jan O. Eeg,"  I discuss low energy aspects of heavy meson decays, where there is at least one heavy meson in the final state. Examples are $B -\bar{B}$ mixing, $B \to D \bar{D}$, $B \to D \eta'$, and $B \to D \gamma$. %and $B \to D W $ (Isgur-Wise function). The analysis is performed in the heavy quark limit within heavy-light chiral perturbation theory. Coefficients of $1/N_c$ suppressed chiral Lagrangian terms (beyond factorization) have been estimated by means of a heavy-light chiral quark model. "
167,Radiative losses and cut-offs of energetic particles at relativistic   shocks,Paul Dempsey and Peter Duffy,"  We investigate the acceleration and simultaneous radiative losses of electrons in the vicinity of relativistic shocks. Particles undergo pitch angle diffusion, gaining energy as they cross the shock by the Fermi mechanism and also emitting synchrotron radiation in the ambient magnetic field. A semi-analytic approach is developed which allows us to consider the behaviour of the shape of the spectral cut-off and the variation of that cut-off with the particle pitch angle. The implications for the synchrotron emission of relativistic jets, such as those in gamma ray burst sources and blazars, are discussed. "
168,Very strong and slowly varying magnetic fields as source of axions,Giorgio Calucci,"  The investigation on the production of particles in slowly varying but extremely intense magnetic field in extended to the case of axions. The motivation is, as for some previously considered cases, the possibility that such kind of magnetic field may exist around very compact astrophysical objects. "
169,Symmetry disquisition on the TiOX phase diagram,"Daniele Fausti, Tom T. A. Lummen, Cosmina Angelescu, Roberto Macovez,   Javier Luzon, Ria Broer, Petra Rudolf, Paul H.M. van Loosdrecht, Natalia   Tristan, Bernd Buchner, Sander van Smaalen, Angela Moller, Gerd Meyer, Timo   Taetz","  The sequence of phase transitions and the symmetry of in particular the low temperature incommensurate and spin-Peierls phases of the quasi one-dimensional inorganic spin-Peierls system TiOX (TiOBr and TiOCl) have been studied using inelastic light scattering experiments. The anomalous first-order character of the transition to the spin-Peierls phase is found to be a consequence of the different symmetries of the incommensurate and spin-Peierls (P$2_{1}/m$) phases.   The pressure dependence of the lowest transition temperature strongly suggests that magnetic interchain interactions play an important role in the formation of the spin-Peierls and the incommensurate phases. Finally, a comparison of Raman data on VOCl to the TiOX spectra shows that the high energy scattering observed previously has a phononic origin. "
